{
  "meta": {
    "id": "review_spec",
    "title": "项目审查规范（Review Spec）",
    "version": "1.0.1",
    "last_updated": "2026-01-15",
    "timezone": "America/Los_Angeles",
    "ssot": true,
    "generated_artifact": "docs/reference/review/REVIEW_SPEC.md",
    "source_file": "docs/reference/review/review_spec.v1.json"
  },
  "scope": {
    "project_type": "LLM RAG 检索/数据管线（Python）",
    "stage": "开发中",
    "priority_order": [
      "文档清晰度",
      "代码质量",
      "可复用性",
      "安全性",
      "报告可读性",
      "其它"
    ],
    "applies_to": [
      "docs/**",
      "src/**",
      "tools/**",
      "schemas/**",
      "policy/**",
      ".github/**"
    ],
    "out_of_scope": [
      "训练数据/模型权重本体",
      "第三方依赖源码（third_party/）的上游变更"
    ]
  },
  "process": {
    "overview": "以 PR 为边界的证据化审查：先保证文档入口与契约可发现，再检查代码不变量与回归信号，最后确认报告与诊断可定位。",
    "roles": {
      "author": "提交者（PR 作者）",
      "reviewer": "审查者（维护者/协作者）"
    },
    "workflow": [
      {
        "step": "PR 准备",
        "must": [
          "变更说明包含：目标、范围、影响面、验证方式（命令+期望信号）。",
          "若改动引入/修改契约（schema/exit code/产物路径），必须同步更新 reference 文档与 SSOT。"
        ]
      },
      {
        "step": "审查执行",
        "must": [
          "按优先级顺序审查：文档→代码→复用→安全→报告。",
          "对关键结论必须给可定位证据（文件/行号、命令输出、schema/commit）。"
        ]
      },
      {
        "step": "合并与写回",
        "must": [
          "合并前 gate 必须 PASS（或明确记录豁免理由与后续收紧触发器）。",
          "必要时写回：docs/howto、docs/reference、HANDOFF 或 Postmortem。"
        ]
      }
    ]
  },
  "checklists": [
    {
      "area": "文档清晰度",
      "items": [
        {
          "id": "DOC-ENTRY-001",
          "level": "MUST",
          "statement": "新增/关键文档必须在可发现入口处有跳转（README 或 docs/INDEX 或 reference 入口）。",
          "rationale": "入口不可发现会导致维护知识无法被复用，审查与排障依赖个人记忆。",
          "evidence": [
            "README.md 与 docs/INDEX.md 中存在可点击相对链接",
            "链接目标文件存在且锚点可定位"
          ]
        },
        {
          "id": "DOC-CAN-002",
          "level": "MUST",
          "statement": "How-to 文档按 Step 组织，每步包含：做什么 + 为何（因果）+ 关键参数/注意，并给验收信号。",
          "rationale": "将文字转化为可执行过程，降低漂移。",
          "evidence": [
            "每个 Step 有命令/改动说明",
            "提供期望输出或产物路径"
          ]
        },
        {
          "id": "DOC-VERSION-003",
          "level": "MUST",
          "statement": "涉及契约/工具/依赖的文档必须标注版本/日期；未指定时按“截至当前日期最新稳定版”。",
          "rationale": "减少因版本差异产生的口径冲突。",
          "evidence": [
            "文档 YAML header 含 version/last_updated",
            "对外部规范/工具引用含版本或访问日期"
          ]
        }
      ]
    },
    {
      "area": "代码质量",
      "items": [
        {
          "id": "CODE-EXIT-001",
          "level": "MUST",
          "statement": "脚本退出码遵循项目契约 {0,2,3}，并在 README/Reference 中可定位说明。",
          "rationale": "CI 与 gate runner 依赖稳定退出码进行自动化判定。",
          "evidence": [
            "tools/check_exit_code_contract.py PASS",
            "新脚本在 docstring 中声明退出码语义"
          ],
          "automation": {
            "tool": "tools/check_exit_code_contract.py",
            "mode": "fail"
          }
        },
        {
          "id": "CODE-LOC-002",
          "level": "SHOULD",
          "statement": "诊断展示使用 `file:line:col`；若输出为“落盘报告”（JSON/Markdown），应额外提供 `loc_uri`（`vscode://file/<abs_path>:line:col`）或把定位渲染为 Markdown 链接，以保证在报告文件内可点击跳转。",
          "rationale": "缩短问题定位路径，提升审查与排障效率。",
          "evidence": [
            "失败输出包含可点击定位，例如: [path/to/file.py:12:5](vscode://file/...:12:5): [FAIL] ..."
          ]
        },
        {
          "id": "CODE-TEST-003",
          "level": "MUST",
          "statement": "关键不变量（高频回归点）必须在 tests/ 或 gate step 中有自动化覆盖。",
          "rationale": "人工审查对隐藏回归不具备稳定性。",
          "evidence": [
            "pytest -q 覆盖关键路径",
            "或 gate profile 中包含对应检查 step"
          ]
        }
      ]
    },
    {
      "area": "可复用性",
      "items": [
        {
          "id": "REUSE-SSOT-001",
          "level": "MUST",
          "statement": "同一规则/契约仅保留一个 SSOT；若需要人类可读文档，应由生成器从 SSOT 生成。",
          "rationale": "减少双写导致的语义漂移。",
          "evidence": [
            "存在 SSOT 文件（yaml/json）",
            "存在生成器或自动校验（--check）"
          ]
        },
        {
          "id": "REUSE-CLI-002",
          "level": "SHOULD",
          "statement": "对外入口优先通过 console_scripts 或 python -m 方式提供，避免依赖相对路径运行。",
          "rationale": "减少因工作目录/导入路径差异导致的运行问题。",
          "evidence": [
            "tools/README.md 中入口说明与 gate 校验一致"
          ]
        }
      ]
    },
    {
      "area": "安全性",
      "items": [
        {
          "id": "SEC-SECRET-001",
          "level": "MUST",
          "statement": "不得在仓库中提交明文密钥/令牌；涉及外部服务的示例必须使用占位符。",
          "rationale": "避免泄露与不可逆风险。",
          "evidence": [
            ".gitleaks.toml / pre-commit 配置存在",
            "新增文档未包含真实 token"
          ]
        },
        {
          "id": "SEC-SUPPLY-002",
          "level": "SHOULD",
          "statement": "新增依赖需给出用途与替代方案，避免引入不必要的攻击面与维护成本。",
          "rationale": "依赖是长期接口，影响可维护与可审计性。",
          "evidence": [
            "pyproject.toml 变更说明含动机与影响",
            "docs/reference/deps_policy.md 更新（如适用）"
          ]
        }
      ]
    },
    {
      "area": "报告可读性",
      "items": [
        {
          "id": "REP-SUMMARY-001",
          "level": "MUST",
          "statement": "机器可读报告（JSON）必须在顶部提供 summary（status/关键计数/路径），并与人类可读输出一致。",
          "rationale": "CI 聚合与人工阅读都需要稳定的入口字段。",
          "evidence": [
            "schema_version 字段存在",
            "status 与退出码映射可复核"
          ]
        },
        {
          "id": "REP-TEMPLATE-002",
          "level": "SHOULD",
          "statement": "对人工审查输出提供统一模板（md/json），包括：结论、假设、步骤、证据、失败分支、MRE。",
          "rationale": "降低不同人输出风格差异带来的理解成本。",
          "evidence": [
            "docs/reference/review/review_report_template.md 存在并可引用"
          ]
        }
      ]
    },
    {
      "area": "其它",
      "items": [
        {
          "id": "OTHER-NOTE-001",
          "level": "MAY",
          "statement": "若本次变更引入新的审查维度（未覆盖在现有清单中），在 SSOT 的 extensions 中记录，并在后续迭代补齐到清单。",
          "rationale": "为演进式架构预留“先记录、后收敛”的接口，避免口径缺失导致的审查争议。",
          "evidence": [
            "extensions 字段存在并记录迁移说明（如适用）"
          ]
        }
      ]
    }
  ],
  "evolution": {
    "compat": {
      "semver": "2.0.0",
      "policy": "新增字段优先放入 extensions；破坏性变更提升 MAJOR，并在 CHANGELOG.md 记录迁移说明。"
    },
    "reserved": {
      "extensions_path": "extensions",
      "reporting_extensions_path": "reporting.extensions"
    }
  },
  "reporting": {
    "templates": {
      "md": "docs/reference/review/review_report_template.md",
      "json": "docs/reference/review/review_report_template.json"
    },
    "extensions": {}
  },
  "references": [
    {
      "title": "Diátaxis documentation framework",
      "url": "https://diataxis.fr/",
      "kind": "official_doc",
      "version_or_date": "accessed 2026-01-12",
      "locator": "Homepage (4 documentation types)"
    },
    {
      "title": "Google Engineering Practices: Code Review Developer Guide",
      "url": "https://google.github.io/eng-practices/review/developer/",
      "kind": "official_doc",
      "version_or_date": "accessed 2026-01-12",
      "locator": "Developer guide"
    },
    {
      "title": "PEP 8 – Style Guide for Python Code",
      "url": "https://peps.python.org/pep-0008/",
      "kind": "standard",
      "version_or_date": "accessed 2026-01-12",
      "locator": "PEP 8"
    },
    {
      "title": "Semantic Versioning 2.0.0",
      "url": "https://semver.org/",
      "kind": "standard",
      "version_or_date": "2.0.0 / accessed 2026-01-12",
      "locator": "Specification"
    },
    {
      "title": "OWASP Code Review Guide v2 (PDF)",
      "url": "https://owasp.org/www-project-code-review-guide/assets/OWASP_Code_Review_Guide_v2.pdf",
      "kind": "official_doc",
      "version_or_date": "v2 / accessed 2026-01-12",
      "locator": "Code Review Guide v2"
    }
  ],
  "extensions": {}
}
